{"cohort_months":["2009-12","2010-01","2010-02","2010-03","2010-04","2010-05","2010-06","2010-07","2010-08","2010-09","2010-10","2010-11","2010-12","2011-01","2011-02","2011-03","2011-04","2011-05","2011-06","2011-07","2011-08","2011-09","2011-10","2011-11"],"definition":"Cohort = month of the customer's first sale invoice in the ledger. Retention(k) = share of the cohort with at least one sale invoice in month first+k. Revenue retention = cohort net sale GBP in month k over month 0.","mean_curve":{"n_cohorts":[24,23,22,21,20,19,18,17,16,15,14,13,12,11,10,9,8,7,6,5,4,3,2,1],"offsets":[0,1,2,3,4,5,6,7,8,9,10,11,12,13,14,15,16,17,18,19,20,21,22,23],"retention":[1.0,0.2334,0.236,0.2498,0.2281,0.2187,0.2217,0.2176,0.1991,0.1944,0.1969,0.2183,0.2274,0.1968,0.1817,0.2028,0.2015,0.2145,0.2105,0.2318,0.2412,0.2556,0.2896,0.4059]},"min_cohort_size":72,"notes":["The 2009-12 cohort (951 customers) mixes true new customers with existing customers whose first purchase was before the ledger starts (left-censoring); it is not a clean acquisition cohort.","Months after 2011-11 are not observed (the ledger ends on 2011-12-09); 2011-12 is dropped as partial. Later cohorts therefore have fewer offsets.","Guest rows (no Customer ID) cannot be tracked and are excluded."],"offsets":[0,1,2,3,4,5,6,7,8,9,10,11,12,13,14,15,16,17,18,19,20,21,22,23],"orders_per_active":[[1.5741,1.6096,1.7571,1.755,1.725,1.7661,1.757,1.8012,1.6791,1.936,1.8603,2.1186,1.9944,1.5746,1.5819,1.6632,1.584,1.8785,1.8037,1.8049,1.719,1.8289,1.9377,2.1192],[1.1495,1.2532,1.3898,1.2241,1.32,1.3684,1.3636,1.3488,1.3333,1.3083,1.4825,1.4848,1.2024,1.2879,1.4028,1.2321,1.3556,1.2933,1.338,1.2297,1.3333,1.3699,1.6022,null],[1.1653,1.2614,1.3882,1.2545,1.2609,1.3514,1.2778,1.2778,1.2292,1.4135,1.2558,1.2553,1.1404,1.1667,1.1522,1.4667,1.35,1.2787,1.3519,1.2907,1.2558,1.5645,null,null],[1.1905,1.3452,1.3824,1.486,1.3529,1.4111,1.3119,1.3333,1.4836,1.4375,1.098,1.1406,1.1364,1.25,1.2727,1.2,1.2857,1.2899,1.2051,1.1667,1.5745,null,null,null],[1.0918,1.1607,1.1964,1.3404,1.2593,1.2462,1.2469,1.3077,1.2581,1.1875,1.1818,1.0732,1.1429,1.1739,1.1522,1.1304,1.2683,1.1364,1.2642,1.3881,null,null,null,null],[1.1176,1.2,1.093,1.0889,1.3333,1.2615,1.3333,1.1562,1.4,1.1429,1.1034,1.1176,1.2308,1.1026,1.28,1.1875,1.3143,1.1905,1.4103,null,null,null,null,null],[1.1386,1.2128,1.24,1.1818,1.2097,1.3289,1.5294,1.125,1.2727,1.1333,1.25,1.3243,1.225,1.1818,1.2667,1.2424,1.2,1.463,null,null,null,null,null,null],[1.2595,1.1724,1.4412,1.2909,1.5556,1.3462,1.4286,1.1852,1.2963,1.5238,1.28,1.2593,1.4583,1.4,1.3333,1.3438,1.5455,null,null,null,null,null,null,null],[1.1595,1.375,1.3404,1.566,1.4444,1.0526,1.0,1.3333,1.2273,1.3333,1.1905,1.2632,1.2083,1.0714,1.1429,1.1875,null,null,null,null,null,null,null,null],[1.1423,1.5273,1.5,1.2903,1.4762,1.32,1.4242,1.2609,1.4839,1.2258,1.4138,1.375,1.4074,1.425,1.775,null,null,null,null,null,null,null,null,null],[1.1493,1.4845,1.2364,1.1064,1.303,1.3871,1.2449,1.1923,1.25,1.1429,1.25,1.1875,1.2778,1.3103,null,null,null,null,null,null,null,null,null,null],[1.2362,1.2281,1.2581,1.2258,1.44,1.1724,1.3095,1.303,1.3214,1.2333,1.2222,1.25,1.3049,null,null,null,null,null,null,null,null,null,null,null],[1.0395,1.2857,1.25,1.0,1.0,1.0,1.25,1.0,1.0,1.0,1.0,1.0,null,null,null,null,null,null,null,null,null,null,null,null],[1.0833,1.4167,1.125,1.2857,1.375,1.6364,1.4545,1.3333,1.125,1.3333,1.2778,null,null,null,null,null,null,null,null,null,null,null,null,null],[1.12,1.4,1.7,1.4783,1.1852,1.15,1.3,1.1579,1.2105,1.2609,null,null,null,null,null,null,null,null,null,null,null,null,null,null],[1.1341,1.4062,1.4615,1.5278,1.175,1.2593,1.1892,1.3333,1.5581,null,null,null,null,null,null,null,null,null,null,null,null,null,null,null],[1.1415,1.6538,1.381,1.2381,1.1053,1.2,1.2632,1.5185,null,null,null,null,null,null,null,null,null,null,null,null,null,null,null,null],[1.1171,1.3846,1.2593,1.2778,1.5833,1.2609,1.5172,null,null,null,null,null,null,null,null,null,null,null,null,null,null,null,null,null],[1.1574,1.32,1.1739,1.2414,1.2727,1.4333,null,null,null,null,null,null,null,null,null,null,null,null,null,null,null,null,null,null],[1.1782,1.1429,1.3,1.2143,1.4,null,null,null,null,null,null,null,null,null,null,null,null,null,null,null,null,null,null,null],[1.0748,1.25,1.4062,1.3929,null,null,null,null,null,null,null,null,null,null,null,null,null,null,null,null,null,null,null,null],[1.1596,1.3725,1.4648,null,null,null,null,null,null,null,null,null,null,null,null,null,null,null,null,null,null,null,null,null],[1.1719,1.5714,null,null,null,null,null,null,null,null,null,null,null,null,null,null,null,null,null,null,null,null,null,null],[1.2618,null,null,null,null,null,null,null,null,null,null,null,null,null,null,null,null,null,null,null,null,null,null,null]],"retention":[[1.0,0.3502,0.3333,0.4248,0.3785,0.3596,0.3764,0.3438,0.3375,0.3617,0.4217,0.4963,0.3764,0.2818,0.244,0.3028,0.2629,0.3028,0.2839,0.2587,0.2545,0.3134,0.3039,0.4059],[1.0,0.2147,0.3207,0.3152,0.2717,0.3098,0.269,0.2337,0.2853,0.3261,0.3098,0.1793,0.2283,0.1793,0.1957,0.1522,0.2446,0.2038,0.1929,0.2011,0.2527,0.1984,0.2527,null],[1.0,0.2347,0.2267,0.2933,0.2453,0.1973,0.192,0.288,0.256,0.2773,0.1147,0.1253,0.152,0.176,0.1227,0.2,0.16,0.1627,0.144,0.2293,0.2293,0.1653,null,null],[1.0,0.1905,0.2313,0.2426,0.2313,0.2041,0.2472,0.3061,0.2766,0.1088,0.1156,0.1451,0.1995,0.1633,0.1995,0.1701,0.1746,0.1565,0.1769,0.2041,0.2132,null,null,null],[1.0,0.1905,0.1905,0.1599,0.1837,0.2211,0.2755,0.2653,0.1054,0.1088,0.0748,0.1395,0.1429,0.1565,0.1565,0.1565,0.1395,0.1497,0.1803,0.2279,null,null,null,null],[1.0,0.1569,0.1686,0.1765,0.1765,0.2549,0.2118,0.1255,0.0588,0.0824,0.1137,0.1333,0.1529,0.1529,0.098,0.1255,0.1373,0.1647,0.1529,null,null,null,null,null],[1.0,0.176,0.1873,0.206,0.2322,0.2846,0.1273,0.0899,0.0824,0.1124,0.1049,0.1386,0.1498,0.1236,0.1124,0.1236,0.1311,0.2022,null,null,null,null,null,null],[1.0,0.1568,0.1838,0.2973,0.2919,0.1405,0.1135,0.1459,0.1459,0.1135,0.1351,0.1459,0.1297,0.1351,0.1946,0.173,0.2378,null,null,null,null,null,null,null],[1.0,0.1963,0.2883,0.3252,0.1656,0.1166,0.0982,0.1288,0.135,0.1288,0.1288,0.1166,0.1472,0.1718,0.1718,0.1963,null,null,null,null,null,null,null,null],[1.0,0.2301,0.2343,0.1297,0.0879,0.1046,0.1381,0.0962,0.1297,0.1297,0.1213,0.1004,0.2259,0.1674,0.1674,null,null,null,null,null,null,null,null,null],[1.0,0.2587,0.1467,0.1253,0.088,0.0827,0.1307,0.1387,0.1067,0.0933,0.1067,0.128,0.192,0.232,null,null,null,null,null,null,null,null,null,null],[1.0,0.1748,0.0951,0.0951,0.0767,0.089,0.1288,0.1012,0.0859,0.092,0.1104,0.1472,0.2515,null,null,null,null,null,null,null,null,null,null,null],[1.0,0.0921,0.0526,0.0921,0.1184,0.0658,0.0526,0.0921,0.0526,0.0263,0.0921,0.1974,null,null,null,null,null,null,null,null,null,null,null,null],[1.0,0.1667,0.2222,0.1944,0.2222,0.1528,0.1528,0.125,0.1111,0.2083,0.25,null,null,null,null,null,null,null,null,null,null,null,null,null],[1.0,0.16,0.16,0.184,0.216,0.16,0.16,0.152,0.152,0.184,null,null,null,null,null,null,null,null,null,null,null,null,null,null],[1.0,0.1788,0.2179,0.2011,0.2235,0.1508,0.2067,0.2011,0.2402,null,null,null,null,null,null,null,null,null,null,null,null,null,null,null],[1.0,0.2453,0.1981,0.1981,0.1792,0.2358,0.1792,0.2547,null,null,null,null,null,null,null,null,null,null,null,null,null,null,null,null],[1.0,0.2342,0.2432,0.1622,0.2162,0.2072,0.2613,null,null,null,null,null,null,null,null,null,null,null,null,null,null,null,null,null],[1.0,0.2315,0.213,0.2685,0.2037,0.2778,null,null,null,null,null,null,null,null,null,null,null,null,null,null,null,null,null,null],[1.0,0.2079,0.297,0.2772,0.3465,null,null,null,null,null,null,null,null,null,null,null,null,null,null,null,null,null,null,null],[1.0,0.2617,0.2991,0.2617,null,null,null,null,null,null,null,null,null,null,null,null,null,null,null,null,null,null,null,null],[1.0,0.2713,0.3777,null,null,null,null,null,null,null,null,null,null,null,null,null,null,null,null,null,null,null,null,null],[1.0,0.3167,null,null,null,null,null,null,null,null,null,null,null,null,null,null,null,null,null,null,null,null,null,null],[1.0,null,null,null,null,null,null,null,null,null,null,null,null,null,null,null,null,null,null,null,null,null,null,null]],"revenue_retention":[[1.0,0.5544,0.4318,0.5539,0.4474,0.4458,0.4416,0.4596,0.4843,0.5506,0.665,0.8376,0.5036,0.3391,0.3151,0.3691,0.2353,0.4062,0.4104,0.3707,0.3971,0.5493,0.604,0.6511],[1.0,0.2448,0.3111,0.3563,0.364,0.3799,0.3272,0.2974,0.3698,0.4648,0.4759,0.2482,0.2662,0.2111,0.3038,0.1915,0.3153,0.2516,0.3009,0.265,0.373,0.3613,0.3636,null],[1.0,0.1959,0.319,0.3197,0.2593,0.2364,0.2258,0.3134,0.3161,0.3246,0.1449,0.1115,0.1635,0.2106,0.123,0.227,0.1762,0.1997,0.1507,0.2697,0.2721,0.232,null,null],[1.0,0.2376,0.2466,0.3079,0.239,0.2672,0.314,0.389,0.3646,0.1005,0.4851,0.1492,0.2074,0.2,0.2252,0.1513,0.2037,0.2391,0.2259,0.281,0.2923,null,null,null],[1.0,0.1516,0.1674,0.2436,0.1805,0.2486,0.2807,0.265,0.082,0.1412,0.0525,0.1365,0.1277,0.1813,0.1339,0.1817,0.1437,0.157,0.2088,0.241,null,null,null,null],[1.0,0.123,0.1274,0.1176,0.1533,0.2822,0.2102,0.0816,0.0536,0.064,0.0845,0.1179,0.1568,0.1646,0.0878,0.133,0.2011,0.1599,0.1427,null,null,null,null,null],[1.0,0.1244,0.173,0.2005,0.2723,0.3727,0.1217,0.1338,0.1864,0.22,0.0938,0.2334,0.3132,0.1257,0.3574,0.1447,0.2715,0.2137,null,null,null,null,null,null],[1.0,0.1193,0.1935,0.3505,0.4045,0.1271,0.1261,0.1469,0.143,0.1409,0.1288,0.1807,0.1732,0.2053,0.2237,0.2223,0.3179,null,null,null,null,null,null,null],[1.0,0.1869,0.3129,0.3921,0.2319,0.0897,0.0845,0.1243,0.1614,0.1612,0.1176,0.1136,0.1673,0.206,0.2401,0.2856,null,null,null,null,null,null,null,null],[1.0,0.2107,0.1948,0.0758,0.1594,0.0519,0.1635,0.0657,0.1853,0.0902,0.1259,0.1666,0.6813,0.1903,0.2951,null,null,null,null,null,null,null,null,null],[1.0,0.2572,0.1053,0.1329,0.0709,0.0616,0.0995,0.0899,0.1254,0.1101,0.0769,0.1186,0.2811,0.3176,null,null,null,null,null,null,null,null,null,null],[1.0,0.1626,0.0977,0.0632,0.058,0.0716,0.1034,0.0757,0.0634,0.0746,0.0957,0.1314,